{"claim_id":"sha256:aef3c9925e419b95fb67db8bed66185dfa8790ef5ca0c9ad0e2dd41d9b0448f1","evidence_id":"sha256:db8d467417dd799587642a7a0fb574b21fe5076e3082771ef833d289ea5f2838","harness":{"input_sha256":{".github/workflows/cdk-cli-blackbox.yml":"sha256:8fd19ad50fccacd4efed3a184a5694cd2fa85359d7077a0c016d311120b6cdd1",".python-version":"sha256:02e735b3dfe1c32833eb550b7ff8ffa17f5f2bc3fa1e7bae61a8f5a3883ce398","Makefile":"sha256:0262d5bdf0fed96acb75db5362cad458209c47c45026e8aa85e51c71da1fd5de","capabilities/cdk/bootstrap-upgrade-execution-evidence.schema.json":"sha256:7cca208bea3979850bfd24265c95bd4b62a733b0fc31e58f2f1d0abe63cb5317","capabilities/cdk/compatibility.json":"sha256:5bbf0e79274d84638d8d6ae9450f6cca257475ab5b5013673ea9fc571c21abef","localstack-core/localstack/cli/_cdk_health_probe.py":"sha256:364746a7edbeb04b5db932c7e79097960782485ddfad9af65e9d2ef7f1ec4941","localstack-core/localstack/cli/cdk.py":"sha256:5ff91068ded44552f07509dfc37ddf0bb82fce29208141c9e8a33d9dccf89639","localstack-core/localstack/services/iam/iam_patches.py":"sha256:0de017fcec913d104ef3f5c5b3f6ab0e1adc335b6e8439ff1ba4b2d30a2f0e41","localstack-core/localstack/services/iam/resource_providers/aws_iam_role.py":"sha256:87017c3250e94ef9d8b294c222cdd94b45ea81dc9fd26760814d901c2fce1f86","localstack-core/localstack/services/iam/resource_providers/aws_iam_role.schema.json":"sha256:0c2a15366b84fb511bde999b091e15c73ee90760167cffb5acb08049a2ae3634","localstack-core/localstack/services/moto.py":"sha256:1ef1f924f2f0456095707ce055f7ec1042d70b87ecf7331e3504790b255c3c65","pyproject.toml":"sha256:800196f9cb7be1b7c723edacdfed7c8916fc03d29487a6dfcd8069eb4c33b67d","requirements-test.txt":"sha256:5f3e38dc3b4cb5a447d7aa764b696e92d402411814cb99418480f81fb65f5379","scripts/run_cdk_cli_blackbox_isolated.sh":"sha256:660fef4b126e94e220a40c0336d5780e56c985c1d1497d0225b7d9b9a0a23795","tests/aws/cli/bootstrap_upgrade_execution_evidence.py":"sha256:1c97e5b444e4cec0467f254d088bad2a5ecfb546cb6f584110e15d46af24e924","tests/aws/cli/execution_evidence.py":"sha256:20a7dfdc5343353548717ba50d7f17a75ccd6037710d1df91d622cdaeb73c9a3","tests/aws/cli/package-lock.json":"sha256:3ef373a339aebe1620b6280f0c07c2b868b11ee89b982529a7bd91e8db7e1d33","tests/aws/cli/package.json":"sha256:2d3162fd15c72d6260536acae6461eca4fd5f0403b9f173d3b2ab77770c5c75d","tests/aws/cli/test_cdk_cli_blackbox.py":"sha256:3eb4695d346097e4a39b8b6060c63fd6df8f88476b4ce9f8b1a4e1de08f232ef","tests/aws/cli/test_cdk_cli_bootstrap_upgrade.py":"sha256:4a7c13739626a8115b6178fbd32868cb1b423be171e6a1d69aa351dd53a81541","tests/aws/cli/validate_junit.py":"sha256:501d5c028b65212f417ed9827f4a3b808fe688ec14eb3bf942e0c453ced43b19","tests/aws/templates/cdk_bootstrap_v28.yaml":"sha256:d84e26fcd602ef1b58a60a71e7f47a4cc9a6fa3f62e7c88182905cfb080fab4e","tests/aws/templates/cdk_bootstrap_v32.yaml":"sha256:a484ad768d3446874161044d986bec096e201a54037c8ce93ed5a0d215e1dd25"}},"lanes":[{"cleanup":{"absent_role_count":5,"bucket_absent":true,"completed":true,"ssm_parameter_absent":true,"stack_absent":true},"command":{"account_id":"000000000000","argv_contract":"bootstrap-upgrade-v28-to-built-in-v32-v1","qualifier":"9dce619f","region":"us-east-1","stack_name":"CDKToolkit-9f0a03ce"},"completed_at":"2026-08-09T09:08:35.663895Z","junit":{"bytes":385,"sha256":"sha256:4796ab7cdd5015b17ba3e71121e0eee7ed4e41017b9fa5dabd06c2564ea8d5da"},"observed_at":"2026-08-09T09:08:31.416301Z","platform":{"id":"linux-amd64","kernel_release":"6.17.0-1020-azure","machine_arch":"x86_64","node_arch":"x64","python_version":"3.13.14"},"receipt_id":"sha256:1e5ff514a77c297c0eba6e904e67b3f9d737c8da4a4249fc4a481b370df06bfd","record_type":"lane-receipt","result":{"duration_ms":6150,"returncode":0,"status":"pass","stderr_bytes":0,"stderr_sha256":"sha256:e3b0c44298fc1c149afbf4c8996fb92427ae41e4649b934ca495991b7852b855","stderr_truncated":false,"stdout_bytes":1782,"stdout_sha256":"sha256:c0bc36de3a72beea63ff20c435214a38ca7f511bbab7fb4a233a03dfa8cceda2","stdout_truncated":false,"timed_out":false},"run":{"commit_sha":"c4a933343b6be315208edd68bb4827650275fcc6","event":"push","ref":"refs/heads/main","repository":"cassiolpaixao90/localstack","run_attempt":1,"run_id":31305122966,"workflow_path":".github/workflows/cdk-cli-blackbox.yml"},"scenario":{"aws_differential":false,"cleanup_required":true,"cloud_assembly_produced":false,"construct_language":null,"id":"bootstrap-upgrade-v28-v32","resource_deployment_performed":true,"result":"cli-pass","seed_mechanism":"cloudformation-api-change-set","target_template_source":"cdk-cli-built-in"},"schema_version":1,"toolchain":{"cdk_cli_version":"2.1135.1","node_version":"22.23.2","source_bootstrap_version":28,"source_template_byte_sha256":"sha256:d84e26fcd602ef1b58a60a71e7f47a4cc9a6fa3f62e7c88182905cfb080fab4e","source_template_semantic_sha256":"sha256:7a86502e6cdd86402f3ce159f12d89e7ed0cc0d37bf399202f6ee98bb41b5169","target_bootstrap_version":32,"target_template_byte_sha256":"sha256:a484ad768d3446874161044d986bec096e201a54037c8ce93ed5a0d215e1dd25","target_template_semantic_sha256":"sha256:9e04a3226e702258e2ba13063dc6ecbc6fba7880d9fa27298445499db453013a"},"verification":{"contract":{"default_qualifier_absent":true,"default_stack_absent":true,"external_policy_preserved_count":5,"inline_policy_delta_verified":true,"managed_policy_delta_verified":true,"preserved_role_identity_count":5,"same_stack_id":true,"seed_output_and_ssm_version":28,"seed_stack_status":"CREATE_COMPLETE","seed_template_matches_fixture":true,"target_output_and_ssm_version":32,"target_stack_status":"UPDATE_COMPLETE","target_template_matches_fixture":true,"trust_policy_delta_count":4},"role_identities_sha256":"sha256:ab2c7afa3f526a8b6f135158e0cdb753c2665037f0472db8cf307ca8cc6c17ac","stack_id_sha256":"sha256:d373741f6557180ecf130bba5f45ebf10bd72139f27bce36f9b9c441cde83981"}},{"cleanup":{"absent_role_count":5,"bucket_absent":true,"completed":true,"ssm_parameter_absent":true,"stack_absent":true},"command":{"account_id":"000000000000","argv_contract":"bootstrap-upgrade-v28-to-built-in-v32-v1","qualifier":"c0e39ad7","region":"us-east-1","stack_name":"CDKToolkit-88b8236c"},"completed_at":"2026-08-09T09:08:20.851771Z","junit":{"bytes":385,"sha256":"sha256:bc7daae9a3d13920e49fcfcd488beee2e317a7b2eba2ae6827dd3ab0605ea9b3"},"observed_at":"2026-08-09T09:08:16.756702Z","platform":{"id":"linux-arm64","kernel_release":"6.17.0-1020-azure","machine_arch":"aarch64","node_arch":"arm64","python_version":"3.13.14"},"receipt_id":"sha256:0b8040511a0955c7de56ff5a10fdd051d285075245f3e87ecc740f662be2f683","record_type":"lane-receipt","result":{"duration_ms":5935,"returncode":0,"status":"pass","stderr_bytes":0,"stderr_sha256":"sha256:e3b0c44298fc1c149afbf4c8996fb92427ae41e4649b934ca495991b7852b855","stderr_truncated":false,"stdout_bytes":1782,"stdout_sha256":"sha256:79d56ed0e0f4677089c34c459ef96906604868c377895569603a24c33d5d8795","stdout_truncated":false,"timed_out":false},"run":{"commit_sha":"c4a933343b6be315208edd68bb4827650275fcc6","event":"push","ref":"refs/heads/main","repository":"cassiolpaixao90/localstack","run_attempt":1,"run_id":31305122966,"workflow_path":".github/workflows/cdk-cli-blackbox.yml"},"scenario":{"aws_differential":false,"cleanup_required":true,"cloud_assembly_produced":false,"construct_language":null,"id":"bootstrap-upgrade-v28-v32","resource_deployment_performed":true,"result":"cli-pass","seed_mechanism":"cloudformation-api-change-set","target_template_source":"cdk-cli-built-in"},"schema_version":1,"toolchain":{"cdk_cli_version":"2.1135.1","node_version":"22.23.2","source_bootstrap_version":28,"source_template_byte_sha256":"sha256:d84e26fcd602ef1b58a60a71e7f47a4cc9a6fa3f62e7c88182905cfb080fab4e","source_template_semantic_sha256":"sha256:7a86502e6cdd86402f3ce159f12d89e7ed0cc0d37bf399202f6ee98bb41b5169","target_bootstrap_version":32,"target_template_byte_sha256":"sha256:a484ad768d3446874161044d986bec096e201a54037c8ce93ed5a0d215e1dd25","target_template_semantic_sha256":"sha256:9e04a3226e702258e2ba13063dc6ecbc6fba7880d9fa27298445499db453013a"},"verification":{"contract":{"default_qualifier_absent":true,"default_stack_absent":true,"external_policy_preserved_count":5,"inline_policy_delta_verified":true,"managed_policy_delta_verified":true,"preserved_role_identity_count":5,"same_stack_id":true,"seed_output_and_ssm_version":28,"seed_stack_status":"CREATE_COMPLETE","seed_template_matches_fixture":true,"target_output_and_ssm_version":32,"target_stack_status":"UPDATE_COMPLETE","target_template_matches_fixture":true,"trust_policy_delta_count":4},"role_identities_sha256":"sha256:ff396c5277f64d83a05584750b2e63a62e9e04fc8d3100f0f22e38d6831dac2e","stack_id_sha256":"sha256:87d5864729fdfed16a615e16bf0de60062623388e1507e0d3fb7acb626e7f3fc"}}],"mode":"diagnostic-candidate","promotion":{"blockers":["not-reviewed-for-promotion","no-clean-bootstrap-create","no-cloud-assembly","no-language-binding","no-aws-differential"],"eligible":false},"record_type":"aggregate","run":{"event":"push","provider":"github-actions","run_attempt":1,"run_id":31305122966,"workflow_path":".github/workflows/cdk-cli-blackbox.yml"},"scenario":{"aws_differential":false,"cleanup_required":true,"cloud_assembly_produced":false,"construct_language":null,"id":"bootstrap-upgrade-v28-v32","resource_deployment_performed":true,"result":"cli-pass","seed_mechanism":"cloudformation-api-change-set","target_template_source":"cdk-cli-built-in"},"schema_version":1,"subject":{"commit_sha":"c4a933343b6be315208edd68bb4827650275fcc6","ref":"refs/heads/main","repository":"cassiolpaixao90/localstack"},"toolchain":{"cdk_cli_version":"2.1135.1","node_version":"22.23.2","npm_integrity":"sha512-g1jcMfWlyYtGamFJ/kPBOCuchl3NfwTF2UwOLTIDN0nJbGm84EAO+c8DlYnaemM8UmKFkdoq4BGdmiNL5nHWwA==","source_bootstrap_version":28,"source_template_byte_sha256":"sha256:d84e26fcd602ef1b58a60a71e7f47a4cc9a6fa3f62e7c88182905cfb080fab4e","source_template_semantic_sha256":"sha256:7a86502e6cdd86402f3ce159f12d89e7ed0cc0d37bf399202f6ee98bb41b5169","target_bootstrap_version":32,"target_t